{
  "schema_version": "1.0",
  "file_id": "file_synthetic",
  "run_id": "run_synthetic",
  "records": [
    {
      "candidate_id": "candidate_synthetic",
      "name": {
        "value": "synthetic_protein",
        "source": "fasta_header",
        "evidence": "h1"
      },
      "molecule_type": "protein",
      "sequence_spans": [
        {
          "block_id": "p1",
          "start": 0,
          "end": 20,
          "order": 1
        }
      ],
      "association_status": "unambiguous",
      "issues": []
    }
  ],
  "coverage": {
    "unresolved_blocks": [],
    "truncated": false
  }
}
